{
  "contract": "ll.bundle/1",
  "bundle_id": "bundle-fixture",
  "kind": "request",
  "scope": {
    "course_id": "fixture-course",
    "term": "fixture-term"
  },
  "created_at": "2026-10-03T12:00:00Z",
  "signer_key_id": "device-key-fixture",
  "record_path": "not-listed.json",
  "files": [
    {
      "path": "payload.json",
      "sha256": "aaaaaaaaaaaaaaaaaaaaaaaaaaaaaaaaaaaaaaaaaaaaaaaaaaaaaaaaaaaaaaaa",
      "bytes": 12,
      "media_type": "application/json"
    }
  ],
  "predecessor_manifest": null
}
